,Question,Category
0, Tell me about a time where you used logic to solve a problem.,Leadership
1," Tell me about a decision you made that proved unpopular, and how you handled it.",Leadership
2, How do you handle your schedule being interrupted?,Leadership
3, Have you ever had to convince a team to work on a project they didn’t like? How did you do it?,Leadership
4, Have you had to solve a squabble between two team members? How did you do it?,Leadership
5," Have you ever gone to bat for your team in opposition to a higher-up in your company? How did you do it, and how did it work out?",Leadership
6, How would you go about motivating a team member who is struggling?,Leadership
7, Have you ever had to make a risky decision? How did it turn out?,Leadership
8, How would you handle a team member who failed to reach their goals?,Leadership
9, How do you prioritize your projects?,Leadership
10, Tell me about a time you solved a problem in a creative or unorthodox way.,Leadership
11, How do you prioritize service to a large number of clients at the same time?,Leadership
12, Tell me about a time where you were the resident expert. Did people trust you?,Leadership
13, Do you consider yourself to be better with written or verbal communication?,Leadership
14, What makes an ideal team member in your eyes?,Leadership
15, Tell me about a time you’ve had to put together a team; how did you choose your candidates?,Leadership
0, Have you been in a situation where you disagree with a company policy? How do you handle it?,Teamwork
1, What do you do if a team member on your project isn’t pulling their weight?,Teamwork
2, How do you find motivation for a project you’re not enthused to work on?,Teamwork
3, Give an example of a successful moment as part of a team.,Teamwork
4, Give an example of an unsuccessful moment as part of a team.,Teamwork
5, How do you handle your team being reprimanded for something you didn’t do?,Teamwork
6, Give an example of a difficult situation with a team member you’ve had to solve.,Teamwork
7, What do you do if your team disagrees with your manager’s decisions?,Teamwork
8, What would you do if your team was waiting on another department dragging their heels?,Teamwork
9, What would you do if your team is stuck waiting for a vendor response?,Teamwork
10, Tell me about a time you’ve had to work with a teammate with a very different personality from your own.,Teamwork
11, Tell me about a time you’ve wished you handled a situation differently.,Teamwork
0, Tell me about a time you were stressed at work and how you handled it.,Stress and Adaptability
1, Describe a time where you worked under pressure for a short time.,Stress and Adaptability
2, Describe a time where you worked under pressure for an extended period.,Stress and Adaptability
3, Tell me what you do when presented with a deadline that seems too short.,Stress and Adaptability
4, How do you handle interruptions when you’re under a time constraint?,Stress and Adaptability
5, Have you ever had to hand off a stressful situation to a coworker or supervisor?,Stress and Adaptability
6, Have you ever been faced with an important decision and not had enough information to make it? What did you do?,Stress and Adaptability
7, You have to make an important decision in a short time constraint; how do you make it?,Stress and Adaptability
8," Tell me about a time you’ve experienced a major setback, and how you handled it.",Stress and Adaptability
9," Tell me about a time you’ve had to get information or resources from someone who isn’t very responsive, and how you handled it.",Stress and Adaptability
10, Tell me about a time where you had to extricate yourself from a tricky situation.,Stress and Adaptability
11," When time is running out, how do you decide what to cut from your to-do list?",Stress and Adaptability
12," Have you ever had to give a presentation, and how did it go?",Stress and Adaptability
13, Tell us about a time you felt defeated in your job. How did you handle it?,Stress and Adaptability
14," What is the costliest mistake you’ve made at your job, and what happened because of it?",Stress and Adaptability
0," What is one example of a goal you achieved, and how did you work to achieve it?",Goals and Ambition
1, Tell me about a time you went above and beyond your job duties.,Goals and Ambition
2, Have you been passed over for a promotion? How did you react?,Goals and Ambition
3, Have you struggled to reach a goal and failed? How did you handle it?,Goals and Ambition
4, How do you set goals in a way that facilitates achieving them?,Goals and Ambition
5, What do you do when you finish your work and the day isn’t over yet?,Goals and Ambition
6, How would you go about seeking out an additional certification for your career?,Goals and Ambition
7, Have you ever had the opportunity to talk to your CEO? What did you talk about?,Goals and Ambition
8, What would you discuss if you could talk to our upper management today?,Goals and Ambition
9, What do you do when you need to make a good impression with a new customer?,Goals and Ambition
10, What do you do when you need to make a good impression with management?,Goals and Ambition
11, What would you do if you were chosen to represent the company at a trade show?,Goals and Ambition
12, What do you do if your job training is going poorly?,Goals and Ambition
13, What do you do if you want more training than what your job is providing you?,Goals and Ambition
14, Have you ever had to take over for your boss? Is it something you would prefer to do?,Goals and Ambition
0," Have you ever noticed a coworker violating company policy? If so, how did you handle it?",Morality and Ethics
1," Have you ever noticed a manager or boss violating company policy? If so, how did you handle it?",Morality and Ethics
2," Have you ever encountered a coworker or boss violating the law, and if so, what did you do?",Morality and Ethics
3, Have you ever had a fellow employee throw you under the bus? How did you handle it?,Morality and Ethics
4," What would you do if you found a manager showing clear favoritism for one employee, or the opposite?",Morality and Ethics
5, Have you ever had the opportunity to duck the blame for something you did? Did you take it?,Morality and Ethics
6, Do you own up to your mistakes when you make them?,Morality and Ethics
7, What is the biggest mistake you’ve made as part of your job? How did you correct it?,Morality and Ethics
8, Have you ever been part of an ethically questionable business? How did you handle it?,Morality and Ethics
9, Have you ever violated company policy to solve a problem or do your job?,Morality and Ethics
10, Have you ever been told to violate safety regulations to do your job? Did you?,Morality and Ethics
11, Have you ever intentionally violated safety policies to do your job?,Morality and Ethics
12," Have you ever been asked to perform a task that goes against your personal values, but not company or legal regulations? Did you do it?",Morality and Ethics
0, Have you ever calmed down an angry customer? How?,Interactions
1, Have you ever been unable to calm down a customer? Why not?,Interactions
2, Have you ever had to deal with an irate manager? What did you do?,Interactions
3, Have you ever bent company policy to satisfy a customer?,Interactions
4, Have you ever been unable to bend company policy and irritated a customer?,Interactions
5, How do you handle bring a problem to the attention of a vendor?,Interactions
6, What would you do if you discovered a gross mistake with a customer’s order after they’ve paid?,Interactions
7, Have you ever had to defend a customer to your superiors? How did you do it?,Interactions
8, Tell me about the best review you’ve ever gotten from a customer.,Interactions
9, Tell me about the worst review you’ve ever gotten from a customer.,Interactions
10, Tell me about a time you’ve had to deal with a client used to exploiting loopholes.,Interactions
0, What do you do to verify that the work you produce is accurate and valuable?,Miscellaneous 
1, How do you review your work to identify errors before finalizing a project?,Miscellaneous 
2, What do you do when you discover a mistake made by a coworker?,Miscellaneous 
3, Which would you lean on to make a decision; logic or a gut feeling?,Miscellaneous 
4, Tell me about a time where your gut feelings have been wrong.,Miscellaneous 
5, Tell me about the most difficult decision you’ve had to make on the job.,Miscellaneous 
6, What do you regret most about your previous job?,Miscellaneous 
7, What would you say is your greatest challenge as a team leader?,Miscellaneous 
8, Have you ever had a time where you’ve proposed a solution to a problem only to have it rejected? What did you do?,Miscellaneous 
9, What would you choose if you had to pick between a professional goal and a personal goal?,Miscellaneous 
